  <!ELEMENT futbol ((jugador|equipo)*)>
  <!ELEMENT jugador EMPTY>
  <!ATTLIST jugador nombre NMTOKENS #REQUIRED>
  <!ATTLIST jugador codigo ID #REQUIRED>
  <!ELEMENT equipo EMPTY>
  <!ATTLIST equipo nombre CDATA #REQUIRED>
  <!ATTLIST equipo jugadores IDREFS #IMPLIED>