<?xml version="1.0" encoding="UTF-8"?>
<!DOCTYPE futbol SYSTEM "SintesMarco_DTD_ejer_6_3.dtd">

<futbol>
<!-- Esto es una anotación     -->

  <jugador nombre="Alfredo Di Stéfano" codigo="ads"/>
  <jugador nombre="Edison Arantes do Nascimento" codigo="ean" />
  <jugador nombre="Diego Armando Maradona" codigo="dam" ></jugador>
  <jugador nombre="Johan Cruyff" codigo="jc" />
    <jugador nombre="adolfo sssss" codigo="dat" />
  <equipo nombre="Società Sportiva Calcio Napoli" jugadores="dam" />
  <equipo nombre="Futbol Club Barcelona" jugadores="jc dat" />

</futbol>